{
 "v": 1,
 "updated": "2026-10-19",
 "czkPerKg": {
  "anglicka_slanina": {
   "albert": 199.0,
   "billa": 269.5,
   "globus": 237.0,
   "kaufland": 219.0,
   "lidl": 179.0,
   "penny": 149.9,
   "tesco": 214.0
  },
  "aperol": {
   "albert": 366.0,
   "globus": 367.2
  },
  "arasidy": {
   "albert": 386.5,
   "globus": 228.0,
   "kaufland": 109.0,
   "lidl": 132.5,
   "penny": 199.5,
   "tesco": 89.8
  },
  "avokado": {
   "albert": 175.9,
   "billa": 175.9,
   "globus": 161.3,
   "kaufland": 85.6,
   "lidl": 146.5,
   "penny": 117.1,
   "tesco": 175.9
  },
  "bageta": {
   "lidl": 299.5
  },
  "balkansky_syr": {
   "albert": 182.9,
   "billa": 169.5,
   "globus": 164.5,
   "lidl": 149.5,
   "penny": 174.5,
   "tesco": 260.0
  },
  "banan": {
   "albert": 24.9,
   "billa": 19.9,
   "globus": 22.9,
   "lidl": 19.9,
   "penny": 22.9,
   "tesco": 26.9
  },
  "batat": {
   "albert": 39.9,
   "billa": 44.9,
   "globus": 39.9,
   "lidl": 34.9
  },
  "bbq_omacka": {
   "albert": 119.3
  },
  "becherovka": {
   "albert": 442.1,
   "billa": 345.7,
   "globus": 345.7
  },
  "bobkovy_list_cerstvy": {
   "albert": 483.6
  },
  "boruvky": {
   "albert": 279.6,
   "billa": 319.2,
   "kaufland": 319.6,
   "lidl": 319.2,
   "penny": 239.2,
   "tesco": 479.2
  },
  "bramborove_knedliky_hotove": {
   "globus": 57.2
  },
  "brambory": {
   "albert": 12.0,
   "billa": 21.2,
   "globus": 28.0,
   "kaufland": 12.0,
   "lidl": 9.0,
   "penny": 12.0,
   "tesco": 12.9
  },
  "brokolice_mrazena": {
   "albert": 166.4,
   "globus": 49.8,
   "kaufland": 55.8,
   "penny": 55.3,
   "tesco": 59.8
  },
  "brusinky_kompot": {
   "billa": 106.2
  },
  "bujon_kostka": {
   "albert": 226.4,
   "kaufland": 178.1,
   "lidl": 311.6,
   "penny": 301.5
  },
  "caj_cerny": {
   "albert": 649.5,
   "billa": 685.1,
   "globus": 757.0
  },
  "caj_ovocny": {
   "albert": 940.0,
   "globus": 647.5
  },
  "candat": {
   "globus": 399.0,
   "lidl": 399.0
  },
  "cedar": {
   "globus": 399.0
  },
  "celer_bulva": {
   "billa": 19.9,
   "globus": 17.9,
   "penny": 17.9
  },
  "cervena_repa": {
   "albert": 19.9,
   "kaufland": 13.3,
   "penny": 11.9
  },
  "cesnek": {
   "billa": 149.5,
   "kaufland": 119.9,
   "lidl": 247.5,
   "penny": 149.5,
   "tesco": 99.0
  },
  "chia": {
   "globus": 134.5
  },
  "chleb": {
   "albert": 99.7,
   "billa": 43.8,
   "globus": 47.3,
   "kaufland": 74.8,
   "lidl": 106.5,
   "penny": 74.8,
   "tesco": 72.7
  },
  "chorizo": {
   "albert": 465.3
  },
  "cibule": {
   "albert": 59.8,
   "billa": 16.9,
   "kaufland": 12.9,
   "lidl": 11.9,
   "penny": 12.9,
   "tesco": 13.9
  },
  "citron": {
   "albert": 99.8,
   "billa": 49.8,
   "globus": 49.8,
   "kaufland": 69.8,
   "lidl": 37.8,
   "penny": 29.9,
   "tesco": 34.9
  },
  "cizrna_sterilovana": {
   "billa": 46.1
  },
  "cocka_cervena": {
   "albert": 49.8,
   "billa": 59.9,
   "kaufland": 55.3
  },
  "cocka_sterilovana": {
   "albert": 59.8,
   "billa": 58.9,
   "tesco": 65.8
  },
  "cokolada_horka": {
   "albert": 784.3,
   "globus": 332.2,
   "lidl": 233.0
  },
  "cokolada_mlecna": {
   "globus": 249.0
  },
  "cornflakes": {
   "billa": 159.8
  },
  "croissant": {
   "albert": 338.0,
   "globus": 161.2,
   "lidl": 121.1
  },
  "cuketa": {
   "albert": 69.8,
   "globus": 34.9,
   "lidl": 39.7
  },
  "cukr": {
   "albert": 33.9,
   "billa": 17.9,
   "globus": 13.9,
   "kaufland": 9.9,
   "lidl": 16.9,
   "penny": 14.9,
   "tesco": 12.9
  },
  "cukr_moucka": {
   "albert": 25.9,
   "billa": 6.9,
   "globus": 17.9,
   "lidl": 19.9
  },
  "cukr_trtinovy": {
   "albert": 49.8,
   "billa": 79.9,
   "globus": 39.8
  },
  "debrecinka": {
   "globus": 169.0,
   "penny": 159.0
  },
  "drozdi_cerstve": {
   "billa": 92.9,
   "kaufland": 49.0
  },
  "drstky": {
   "lidl": 119.8
  },
  "dyne_hokkaido": {
   "kaufland": 112.2,
   "lidl": 27.4
  },
  "dyne_muskatova": {
   "billa": 29.9
  },
  "dyne_spagetova": {
   "lidl": 29.9
  },
  "dynova_seminka": {
   "globus": 199.5
  },
  "eidam": {
   "albert": 199.0,
   "billa": 199.6,
   "globus": 156.0,
   "kaufland": 139.0,
   "lidl": 129.0,
   "penny": 149.0,
   "tesco": 179.6
  },
  "emental": {
   "globus": 319.0,
   "kaufland": 157.2,
   "penny": 179.6
  },
  "erythritol": {
   "globus": 179.8
  },
  "fazole_bile_sterilovane": {
   "albert": 160.0,
   "billa": 90.8,
   "globus": 31.5,
   "kaufland": 51.9,
   "lidl": 60.2,
   "penny": 37.2,
   "tesco": 96.1
  },
  "fazole_cervene_sterilovane": {
   "globus": 92.8,
   "kaufland": 50.0,
   "penny": 35.5
  },
  "fazolove_lusky": {
   "albert": 166.3
  },
  "fernet": {
   "albert": 318.5,
   "globus": 267.8
  },
  "feta": {
   "albert": 690.0,
   "billa": 412.7
  },
  "fiky_cerstve": {
   "albert": 118.0,
   "globus": 158.0,
   "lidl": 138.0
  },
  "fusilli": {
   "lidl": 31.8
  },
  "gin": {
   "albert": 470.8,
   "globus": 531.8,
   "lidl": 683.7
  },
  "gnocchi": {
   "billa": 35.8,
   "globus": 47.8,
   "penny": 49.8
  },
  "gouda": {
   "albert": 149.8,
   "billa": 169.0,
   "globus": 139.0,
   "kaufland": 369.0,
   "lidl": 457.5,
   "penny": 159.8,
   "tesco": 149.0
  },
  "granatove_jablko": {
   "lidl": 59.6
  },
  "grilovaci_koreni": {
   "albert": 567.9
  },
  "grissini": {
   "penny": 149.5
  },
  "halibut": {
   "globus": 539.0
  },
  "halloumi": {
   "albert": 282.5,
   "kaufland": 266.2
  },
  "hermelin": {
   "albert": 295.2,
   "billa": 371.8,
   "globus": 270.4,
   "kaufland": 299.5,
   "lidl": 179.3,
   "penny": 274.2,
   "tesco": 274.1
  },
  "hliva_ustricna": {
   "albert": 166.3,
   "lidl": 133.0
  },
  "horcice": {
   "albert": 76.6,
   "globus": 35.6,
   "kaufland": 33.2,
   "penny": 27.2,
   "tesco": 56.7
  },
  "horcice_dijonska": {
   "albert": 237.6,
   "globus": 220.5,
   "penny": 76.5
  },
  "houskovy_knedlik": {
   "albert": 39.9
  },
  "hovezi_kliska": {
   "albert": 249.0,
   "billa": 299.8,
   "globus": 249.0,
   "kaufland": 289.9,
   "penny": 249.9,
   "tesco": 249.9
  },
  "hovezi_nizky_rostenec": {
   "albert": 155.3
  },
  "hovezi_rostenec": {
   "albert": 369.0,
   "lidl": 799.0
  },
  "hovezi_zadni": {
   "albert": 249.0,
   "billa": 319.6,
   "globus": 339.0,
   "kaufland": 289.9,
   "lidl": 289.9
  },
  "hovezi_zebra": {
   "billa": 189.9,
   "globus": 199.0
  },
  "hrasek_mrazeny": {
   "kaufland": 74.5,
   "penny": 72.2
  },
  "hrozny": {
   "albert": 69.8,
   "billa": 65.8,
   "globus": 34.9,
   "lidl": 39.9,
   "penny": 39.9
  },
  "hruska": {
   "albert": 193.9,
   "billa": 59.9,
   "globus": 29.9,
   "kaufland": 39.9,
   "lidl": 19.9,
   "penny": 50.8,
   "tesco": 36.9
  },
  "hummus": {
   "lidl": 199.5
  },
  "jablecne_pyre": {
   "billa": 64.1
  },
  "jablko": {
   "albert": 29.9,
   "billa": 38.4,
   "globus": 29.9,
   "kaufland": 28.3,
   "lidl": 17.9,
   "penny": 24.9,
   "tesco": 24.9
  },
  "jahody": {
   "globus": 219.6,
   "kaufland": 239.6
  },
  "jaternice": {
   "billa": 133.0
  },
  "jeleni_maso": {
   "globus": 356.1
  },
  "jogurt_bily": {
   "albert": 69.4,
   "billa": 44.7,
   "globus": 59.9,
   "kaufland": 68.8,
   "lidl": 59.7,
   "penny": 56.1,
   "tesco": 93.1
  },
  "jogurt_ovocny": {
   "globus": 52.7
  },
  "jogurt_recky": {
   "albert": 119.2,
   "billa": 99.3,
   "globus": 128.3,
   "kaufland": 92.1,
   "lidl": 70.7,
   "penny": 106.4,
   "tesco": 106.4
  },
  "kachna_cela": {
   "albert": 99.9,
   "billa": 99.9,
   "globus": 89.9,
   "kaufland": 79.9,
   "tesco": 89.9
  },
  "kachni_prsa": {
   "albert": 245.1
  },
  "kachni_stehna": {
   "albert": 236.2
  },
  "kakao": {
   "albert": 549.0,
   "billa": 549.0,
   "kaufland": 349.0,
   "lidl": 349.5,
   "penny": 349.0,
   "tesco": 399.0
  },
  "kaki": {
   "globus": 87.7
  },
  "kapr": {
   "kaufland": 229.0,
   "penny": 219.0
  },
  "kastany": {
   "billa": 158.0
  },
  "kava_instantni": {
   "billa": 599.5,
   "globus": 899.5
  },
  "kava_mleta": {
   "albert": 537.8,
   "billa": 519.6,
   "globus": 349.8,
   "kaufland": 359.6,
   "lidl": 199.9,
   "penny": 310.9,
   "tesco": 339.6
  },
  "kecup": {
   "albert": 102.7,
   "billa": 139.8,
   "globus": 129.1,
   "kaufland": 62.9,
   "lidl": 79.9,
   "penny": 67.6,
   "tesco": 61.0
  },
  "kedlubna": {
   "albert": 39.7,
   "billa": 39.7,
   "globus": 39.7,
   "kaufland": 39.7,
   "lidl": 33.0,
   "penny": 33.0,
   "tesco": 39.7
  },
  "kefir": {
   "albert": 100.6,
   "billa": 78.2,
   "globus": 28.3,
   "kaufland": 59.7,
   "lidl": 51.2,
   "penny": 24.1,
   "tesco": 58.0
  },
  "kesu": {
   "albert": 279.6,
   "billa": 266.0,
   "globus": 299.5
  },
  "kimchi": {
   "billa": 359.7
  },
  "kiwi": {
   "kaufland": 198.7,
   "lidl": 158.7
  },
  "klobasa": {
   "albert": 290.8,
   "billa": 149.8,
   "globus": 139.0,
   "kaufland": 222.0,
   "penny": 171.5,
   "tesco": 139.0
  },
  "kokos_strouhany": {
   "billa": 109.8,
   "globus": 109.8
  },
  "kokosove_mleko": {
   "billa": 99.8,
   "kaufland": 87.2,
   "penny": 49.8
  },
  "kola": {
   "globus": 19.4
  },
  "kompot_ananasovy": {
   "billa": 39.9,
   "lidl": 29.9,
   "penny": 29.9
  },
  "kompot_broskvovy": {
   "globus": 42.6
  },
  "kompot_merunkovy": {
   "kaufland": 53.5
  },
  "kondenzovane_mleko": {
   "globus": 87.9
  },
  "korbaciky": {
   "globus": 239.0
  },
  "kozi_syr": {
   "albert": 479.0,
   "kaufland": 519.2
  },
  "kralik": {
   "albert": 199.0,
   "billa": 199.9
  },
  "krevety": {
   "albert": 586.2,
   "billa": 488.4,
   "globus": 399.0,
   "kaufland": 499.5,
   "lidl": 399.7,
   "penny": 359.6
  },
  "kroupy": {
   "albert": 92.7
  },
  "kruti_prsa": {
   "albert": 199.0,
   "globus": 219.9,
   "lidl": 199.9,
   "penny": 199.9
  },
  "kruti_stehna": {
   "lidl": 89.9
  },
  "kukurice_klas": {
   "globus": 74.8
  },
  "kure_cele": {
   "albert": 104.9,
   "billa": 79.8,
   "globus": 49.9,
   "kaufland": 49.9,
   "lidl": 239.8,
   "penny": 59.9,
   "tesco": 49.9
  },
  "kureci_jatra": {
   "penny": 49.8
  },
  "kureci_kridla": {
   "albert": 79.9,
   "billa": 127.0,
   "kaufland": 119.9,
   "lidl": 216.3,
   "penny": 79.9,
   "tesco": 79.9
  },